### ISSUE TITLE
Insane amount of constant repeated DNS requests 4-10pkt/sec

### ISSUE THREAD

**Issue by darkfires** [vstakhov/rspamd#1729]
### Classification (Please choose *one* option):

* [ ] Crash/Hang/Data loss
* [ ] WebUI/Usability
* [ ] Serious bug
* [x] Other bug
* [ ] Feature
* [ ] Enhancement

### Reproducibility (Please choose *one* option):

* [X] Always
* [ ] Sometimes
* [ ] Rarely
* [ ] Unable
* [ ] I didn’t try
* [ ] Not applicable

### Description (Please provide a descriptive summary of the issue):
Way too many constant DNS requests for a completely idle test system.  576 established DNS connections, 4-10 packets/sec and it is constantly repeating the same queries over and over.
I have nothing but the most basic example config and haven't put any real mail thru the system yet other than a few test emails. Doesn't ever stop.

root@pluto 18:45:46 ~ # netstat -alnp |grep rspamd |grep :53| grep -c ESTAB
576
root@pluto 18:50:28 ~ # tcpdump -n port 53
18:44:06.039020 IP 192.168.30.5.57316 > 192.168.30.2.53: 8185+ [1au] A? multi.surbl.org. (44)
18:44:06.039188 IP 192.168.30.2.53 > 192.168.30.5.57316: 8185 0/1/0 (82)
18:44:06.208017 IP 192.168.30.5.58413 > 192.168.30.2.53: 29879+ [1au] A? 1.0.0.127.bl.score.senderscore.com. (63)
18:44:06.208223 IP 192.168.30.2.53 > 192.168.30.5.58413: 29879 NXDomain 0/1/0 (114)
18:44:06.468748 IP 192.168.30.5.51575 > 192.168.30.2.53: 46980+ [1au] A? public.sarbl.org. (45)
18:44:06.468955 IP 192.168.30.2.53 > 192.168.30.5.51575: 46980 0/1/0 (85)
18:44:06.523039 IP 192.168.30.5.52771 > 192.168.30.2.53: 38806+ [1au] A? fresh15.spameatingmonkey.net. (57)
18:44:06.523224 IP 192.168.30.2.53 > 192.168.30.5.52771: 38806 0/1/0 (117)
18:44:06.700623 IP 192.168.30.5.49825 > 192.168.30.2.53: 54706+ [1au] A? 1.0.0.127.email-bl.rambler.ru. (58)
18:44:06.700789 IP 192.168.30.2.53 > 192.168.30.5.49825: 54706 NXDomain 0/1/0 (112)
18:44:06.942828 IP 192.168.30.5.34510 > 192.168.30.2.53: 1969+ [1au] A? uribl.spameatingmonkey.net. (55)
18:44:06.942993 IP 192.168.30.2.53 > 192.168.30.5.34510: 1969 0/1/0 (115)
18:44:07.163048 IP 192.168.30.5.58899 > 192.168.30.2.53: 21551+ [1au] A? 1.0.0.127.zen.spamhaus.org. (55)
18:44:07.163244 IP 192.168.30.2.53 > 192.168.30.5.58899: 21551 NXDomain 0/1/0 (108)
18:44:07.226000 IP 192.168.30.5.52372 > 192.168.30.2.53: 45377+ [1au] A? uribl.rambler.ru. (45)
18:44:07.226164 IP 192.168.30.2.53 > 192.168.30.5.52372: 45377 0/1/0 (99)
18:44:07.871625 IP 192.168.30.5.34180 > 192.168.30.2.53: 33145+ [1au] A? multi.uribl.com. (44)
18:44:07.979005 IP 192.168.30.2.53 > 192.168.30.5.34180: 33145 0/1/0 (78)
18:44:08.585242 IP 192.168.30.5.57957 > 192.168.30.2.53: 16383+ [1au] A? 1.0.0.127.zen.spamhaus.org. (55)
18:44:08.585391 IP 192.168.30.2.53 > 192.168.30.5.57957: 16383 NXDomain 0/1/0 (108)
18:44:08.660000 IP 192.168.30.5.52098 > 192.168.30.2.53: 1540+ [1au] A? uribl.rambler.ru. (45)
18:44:08.660183 IP 192.168.30.2.53 > 192.168.30.5.52098: 1540 0/1/0 (99)
18:44:08.844014 IP 192.168.30.5.44528 > 192.168.30.2.53: 27678+ [1au] A? 1.0.0.127.bl.score.senderscore.com. (63)
18:44:08.844166 IP 192.168.30.2.53 > 192.168.30.5.44528: 27678 NXDomain 0/1/0 (114)
18:44:09.521322 IP 192.168.30.5.52967 > 192.168.30.2.53: 57649+ [1au] A? fresh15.spameatingmonkey.net. (57)
18:44:09.572192 IP 192.168.30.2.53 > 192.168.30.5.52967: 57649 0/1/0 (117)
18:44:10.252858 IP 192.168.30.5.50428 > 192.168.30.2.53: 56732+ [1au] A? multi.surbl.org. (44)
18:44:10.253016 IP 192.168.30.2.53 > 192.168.30.5.50428: 56732 0/1/0 (82)
18:44:11.025003 IP 192.168.30.5.48513 > 192.168.30.2.53: 37212+ [1au] A? rspamd.com. (39)
18:44:11.025015 IP 192.168.30.5.51100 > 192.168.30.2.53: 57515+ [1au] AAAA? rspamd.com. (39)
18:44:11.025201 IP 192.168.30.2.53 > 192.168.30.5.48513: 37212 1/0/0 A 88.99.142.95 (44)
18:44:11.025215 IP 192.168.30.2.53 > 192.168.30.5.51100: 57515 0/1/0 (89)
18:44:11.303379 IP 192.168.30.5.49664 > 192.168.30.2.53: 8075+ [1au] A? public.sarbl.org. (45)
18:44:11.303558 IP 192.168.30.2.53 > 192.168.30.5.49664: 8075 0/1/0 (85)
18:44:11.676091 IP 192.168.30.5.56108 > 192.168.30.2.53: 4528+ [1au] A? fresh15.spameatingmonkey.net. (57)
18:44:11.676249 IP 192.168.30.2.53 > 192.168.30.5.56108: 4528 0/1/0 (117)
18:44:12.373854 IP 192.168.30.5.45185 > 192.168.30.2.53: 57253+ [1au] A? 1.0.0.127.spam.abuse.ch. (52)
18:44:12.374030 IP 192.168.30.2.53 > 192.168.30.5.45185: 57253 NXDomain 0/1/0 (104)
18:44:13.042820 IP 192.168.30.5.38867 > 192.168.30.2.53: 1770+ [1au] A? 1.0.0.127.spam.abuse.ch. (52)
18:44:13.043015 IP 192.168.30.2.53 > 192.168.30.5.38867: 1770 NXDomain 0/1/0 (104)
18:44:13.287707 IP 192.168.30.5.46901 > 192.168.30.2.53: 6253+ [1au] A? fresh15.spameatingmonkey.net. (57)
18:44:13.287860 IP 192.168.30.2.53 > 192.168.30.5.46901: 6253 0/1/0 (117)
18:44:13.991861 IP 192.168.30.5.38728 > 192.168.30.2.53: 42470+ [1au] A? 1.0.0.127.spam.abuse.ch. (52)
18:44:13.992012 IP 192.168.30.2.53 > 192.168.30.5.38728: 42470 NXDomain 0/1/0 (104)
18:44:14.393611 IP 192.168.30.5.51804 > 192.168.30.2.53: 8648+ [1au] A? public.sarbl.org. (45)
18:44:14.393789 IP 192.168.30.2.53 > 192.168.30.5.51804: 8648 0/1/0 (85)
18:44:15.921770 IP 192.168.30.5.43620 > 192.168.30.2.53: 48506+ [1au] A? rspamd.com. (39)
18:44:15.921785 IP 192.168.30.5.52771 > 192.168.30.2.53: 12920+ [1au] AAAA? rspamd.com. (39)
18:44:15.921956 IP 192.168.30.2.53 > 192.168.30.5.43620: 48506 1/0/0 A 88.99.142.95 (44)
18:44:15.921969 IP 192.168.30.2.53 > 192.168.30.5.52771: 12920 0/1/0 (89)
18:44:15.944068 IP 192.168.30.5.50379 > 192.168.30.2.53: 48577+ [1au] A? uribl.spameatingmonkey.net. (55)
18:44:15.982265 IP 192.168.30.2.53 > 192.168.30.5.50379: 48577 0/1/0 (115)
18:44:16.236440 IP 192.168.30.5.41169 > 192.168.30.2.53: 10472+ [1au] A? 1.0.0.127.email-bl.rambler.ru. (58)
18:44:16.236640 IP 192.168.30.2.53 > 192.168.30.5.41169: 10472 NXDomain 0/1/0 (112)
18:44:16.533791 IP 192.168.30.5.58156 > 192.168.30.2.53: 16625+ [1au] A? 1.0.0.127.sbl.spamhaus.org. (55)
18:44:16.729017 IP 192.168.30.2.53 > 192.168.30.5.58156: 16625 NXDomain 0/1/0 (108)
18:44:17.592099 IP 192.168.30.5.53057 > 192.168.30.2.53: 38417+ [1au] A? rspamd.com. (39)
18:44:17.592112 IP 192.168.30.5.44390 > 192.168.30.2.53: 23439+ [1au] AAAA? rspamd.com. (39)
18:44:17.592289 IP 192.168.30.2.53 > 192.168.30.5.53057: 38417 1/0/0 A 88.99.142.95 (44)
18:44:17.592301 IP 192.168.30.2.53 > 192.168.30.5.44390: 23439 0/1/0 (89)
18:44:18.466198 IP 192.168.30.5.46005 > 192.168.30.2.53: 56136+ [1au] A? 1.0.0.127.zen.spamhaus.org. (55)
18:44:18.505515 IP 192.168.30.2.53 > 192.168.30.5.46005: 56136 NXDomain 0/1/0 (108)
18:44:18.529848 IP 192.168.30.5.58182 > 192.168.30.2.53: 11097+ [1au] A? fresh15.spameatingmonkey.net. (57)
18:44:18.530008 IP 192.168.30.2.53 > 192.168.30.5.58182: 11097 0/1/0 (117)
18:44:18.872190 IP 192.168.30.5.39396 > 192.168.30.2.53: 43214+ [1au] A? multi.surbl.org. (44)
18:44:18.872342 IP 192.168.30.2.53 > 192.168.30.5.39396: 43214 0/1/0 (82)
18:44:18.931424 IP 192.168.30.5.48846 > 192.168.30.2.53: 38555+ [1au] A? multi.surbl.org. (44)
18:44:18.931609 IP 192.168.30.2.53 > 192.168.30.5.48846: 38555 0/1/0 (82)
18:44:19.352991 IP 192.168.30.5.56801 > 192.168.30.2.53: 46544+ [1au] A? rspamd.com. (39)
18:44:19.353015 IP 192.168.30.5.43031 > 192.168.30.2.53: 24830+ [1au] AAAA? rspamd.com. (39)
18:44:19.353178 IP 192.168.30.2.53 > 192.168.30.5.56801: 46544 1/0/0 A 88.99.142.95 (44)
18:44:19.353191 IP 192.168.30.2.53 > 192.168.30.5.43031: 24830 0/1/0 (89)
18:44:20.359604 IP 192.168.30.5.57881 > 192.168.30.2.53: 11934+ [1au] A? 1.0.0.127.bl.score.senderscore.com. (63)
18:44:20.359756 IP 192.168.30.2.53 > 192.168.30.5.57881: 11934 NXDomain 0/1/0 (114)
18:44:20.612475 IP 192.168.30.5.53545 > 192.168.30.2.53: 32026+ [1au] A? 1.0.0.127.sbl.spamhaus.org. (55)
18:44:20.612657 IP 192.168.30.2.53 > 192.168.30.5.53545: 32026 NXDomain 0/1/0 (108)
18:44:20.679579 IP 192.168.30.5.39497 > 192.168.30.2.53: 56595+ [1au] A? dbl.spamhaus.org. (45)
18:44:20.783821 IP 192.168.30.2.53 > 192.168.30.5.39497: 56595 0/1/0 (98)
18:44:20.895618 IP 192.168.30.5.58409 > 192.168.30.2.53: 8106+ [1au] A? rspamd.com. (39)
18:44:20.895642 IP 192.168.30.5.37010 > 192.168.30.2.53: 62989+ [1au] AAAA? rspamd.com. (39)
18:44:20.895816 IP 192.168.30.2.53 > 192.168.30.5.58409: 8106 1/0/0 A 88.99.142.95 (44)
18:44:20.895830 IP 192.168.30.2.53 > 192.168.30.5.37010: 62989 0/1/0 (89)
18:44:21.044897 IP 192.168.30.5.51281 > 192.168.30.2.53: 61480+ [1au] A? 1.0.0.127.bl.spameatingmonkey.net. (62)
18:44:21.045087 IP 192.168.30.2.53 > 192.168.30.5.51281: 61480 NXDomain 0/1/0 (122)
18:44:21.945185 IP 192.168.30.5.34256 > 192.168.30.2.53: 45456+ [1au] A? 1.0.0.127.zen.spamhaus.org. (55)
18:44:21.945370 IP 192.168.30.2.53 > 192.168.30.5.34256: 45456 NXDomain 0/1/0 (108)
18:44:21.992694 IP 192.168.30.5.50374 > 192.168.30.2.53: 22972+ [1au] A? 1.0.0.127.zen.spamhaus.org. (55)
18:44:21.992851 IP 192.168.30.2.53 > 192.168.30.5.50374: 22972 NXDomain 0/1/0 (108)
18:44:22.108708 IP 192.168.30.5.44897 > 192.168.30.2.53: 54422+ [1au] A? multi.uribl.com. (44)
18:44:22.144332 IP 192.168.30.2.53 > 192.168.30.5.44897: 54422 0/1/0 (78)
18:44:22.146355 IP 192.168.30.5.56728 > 192.168.30.2.53: 5740+ [1au] A? 1.0.0.127.bl.ipv6.spameatingmonkey.net. (67)
18:44:22.146555 IP 192.168.30.2.53 > 192.168.30.5.56728: 5740 NXDomain 0/1/0 (127)
18:44:22.328343 IP 192.168.30.5.56108 > 192.168.30.2.53: 15718+ [1au] A? rspamd.com. (39)
18:44:22.328367 IP 192.168.30.5.58156 > 192.168.30.2.53: 31683+ [1au] AAAA? rspamd.com. (39)
18:44:22.328493 IP 192.168.30.2.53 > 192.168.30.5.56108: 15718 1/0/0 A 88.99.142.95 (44)
18:44:22.328519 IP 192.168.30.2.53 > 192.168.30.5.58156: 31683 0/1/0 (89)
18:44:22.434425 IP 192.168.30.5.47700 > 192.168.30.2.53: 59882+ [1au] A? 1.0.0.127.bl.spameatingmonkey.net. (62)
18:44:22.434572 IP 192.168.30.2.53 > 192.168.30.5.47700: 59882 NXDomain 0/1/0 (122)
18:44:22.654327 IP 192.168.30.5.40887 > 192.168.30.2.53: 28020+ [1au] A? rspamd.com. (39)
18:44:22.654352 IP 192.168.30.5.41814 > 192.168.30.2.53: 22498+ [1au] AAAA? rspamd.com. (39)
18:44:22.654505 IP 192.168.30.2.53 > 192.168.30.5.40887: 28020 1/0/0 A 88.99.142.95 (44)
18:44:22.654535 IP 192.168.30.2.53 > 192.168.30.5.41814: 22498 0/1/0 (89)
18:44:23.626797 IP 192.168.30.5.39962 > 192.168.30.2.53: 26221+ [1au] A? 1.0.0.127.bl.ipv6.spameatingmonkey.net. (67)
18:44:23.626995 IP 192.168.30.2.53 > 192.168.30.5.39962: 26221 NXDomain 0/1/0 (127)
18:44:23.641220 IP 192.168.30.5.44054 > 192.168.30.2.53: 7341+ [1au] A? 1.0.0.127.spam.abuse.ch. (52)
18:44:23.641446 IP 192.168.30.2.53 > 192.168.30.5.44054: 7341 NXDomain 0/1/0 (104)
18:44:24.122675 IP 192.168.30.5.50735 > 192.168.30.2.53: 16427+ [1au] A? multi.uribl.com. (44)
18:44:24.122835 IP 192.168.30.2.53 > 192.168.30.5.50735: 16427 0/1/0 (78)
18:44:24.712412 IP 192.168.30.5.36282 > 192.168.30.2.53: 22670+ [1au] A? uribl.rambler.ru. (45)
18:44:24.712593 IP 192.168.30.2.53 > 192.168.30.5.36282: 22670 0/1/0 (99)
18:44:24.849852 IP 192.168.30.5.45704 > 192.168.30.2.53: 5426+ [1au] A? 1.0.0.127.spam.abuse.ch. (52)
18:44:24.850031 IP 192.168.30.2.53 > 192.168.30.5.45704: 5426 NXDomain 0/1/0 (104)
18:44:25.336775 IP 192.168.30.5.52723 > 192.168.30.2.53: 45588+ [1au] A? uribl.spameatingmonkey.net. (55)
18:44:25.336920 IP 192.168.30.2.53 > 192.168.30.5.52723: 45588 0/1/0 (115)
18:44:25.453557 IP 192.168.30.5.41115 > 192.168.30.2.53: 18961+ [1au] A? 1.0.0.127.spam.abuse.ch. (52)
18:44:25.453750 IP 192.168.30.2.53 > 192.168.30.5.41115: 18961 NXDomain 0/1/0 (104)
18:44:25.534761 IP 192.168.30.5.37147 > 192.168.30.2.53: 53306+ [1au] A? 1.0.0.127.bl.spameatingmonkey.net. (62)
18:44:25.534989 IP 192.168.30.2.53 > 192.168.30.5.37147: 53306 NXDomain 0/1/0 (122)
18:44:25.701906 IP 192.168.30.5.51100 > 192.168.30.2.53: 45073+ [1au] A? 1.0.0.127.email-bl.rambler.ru. (58)
18:44:25.702099 IP 192.168.30.2.53 > 192.168.30.5.51100: 45073 NXDomain 0/1/0 (112)
18:44:26.363170 IP 192.168.30.5.54605 > 192.168.30.2.53: 63584+ [1au] A? 1.0.0.127.zen.spamhaus.org. (55)
18:44:26.363340 IP 192.168.30.2.53 > 192.168.30.5.54605: 63584 NXDomain 0/1/0 (108)
18:44:26.515076 IP 192.168.30.5.47388 > 192.168.30.2.53: 56492+ [1au] A? 1.0.0.127.zen.spamhaus.org. (55)
18:44:26.515227 IP 192.168.30.2.53 > 192.168.30.5.47388: 56492 NXDomain 0/1/0 (108)
18:44:26.607484 IP 192.168.30.5.45849 > 192.168.30.2.53: 22642+ [1au] A? 1.0.0.127.zen.spamhaus.org. (55)
18:44:26.607658 IP 192.168.30.2.53 > 192.168.30.5.45849: 22642 NXDomain 0/1/0 (108)

**Comment by vstakhov** [comment]
Rspamd monitors DNS resources. It sends a single request once per minute for each resource. However, each Rspamd working process does this checks. E.g. if you are using default settings and Rspamd runs, lets say on a 16 cores system, then you might have 16 normal processes, 16 proxy processes and a controller. In total, you will have like 33 of processes that are querying like 20 of DNS resources.

**Comment by vstakhov** [comment]
I'm currently working to resolve this issue eventually.

**Comment by csmk** [comment]
@darkfires, thank you for bringing this up. I've been experiencing a similar [issue](https://github.com/vstakhov/rspamd/issues/1721).

> I'm currently working to resolve this issue eventually.

Much appreciated.

**Comment by darkfires** [comment]
I would think this issue should get some priority, it's a big enough concern to me that until it's fixed I've switched back to SpamAssassin.  Most people probably don't notice it's an issue because they don't analyze their traffic or check amount of connections being performed... but anyone else with a large amount of cores on their system (for the record mine has 8 cores, 8 threads) and using upstream DNS servers, it's technically flooding them needlessly.  It shouldn't be performing ANY REQUESTS WHAT SO EVER until a mail comes thru to be processed, regardless of how many threads/processes are running.  And why is it even looking up rspamd.com, shouldn't it just be checking RBL/SBL stuff?

**Comment by vstakhov** [comment]
So set the number of workers for your system appropriately. I don't care where do you switch and why. Furthermore, I won't tolerate arrogant behaviour, hence, I'm closing this issue.
