### ISSUE TITLE
Why local fuzzy worker doesn't store shingles?

### ISSUE THREAD

**Issue by moisseev** [vstakhov/rspamd#478]
~~~sql
# sqlite3 fuzzy.db
SQLite version 3.9.2 2015-11-02 18:31:45
Enter ".help" for usage hints.
sqlite> .tables
digests   shingles
sqlite> SELECT Count(*) FROM digests;
15517
sqlite> SELECT Count(*) FROM shingles;
0
sqlite> .quit
~~~

rspamd.conf.local.override
~~~
worker {
    type = "fuzzy";
    count = 1;
    bind_socket = "*:11335";
    hash_file = "${DBDIR}/fuzzy.db"
    expire = 360d;
    allow_update = "127.0.0.1";
}

# Rspamd modules configuration

fuzzy_check {
    # Include dynamic conf for the rule
    .include(try=true,priority=1) "${DBDIR}/dynamic/fuzzy_check.conf"
    min_bytes = 300;
    rule {
        servers = "rspamd.com:11335";
        encryption_key = "icy63itbhhni8bq15ntp5n5symuixf73s1kpjh6skaq4e7nx5fiy";
        symbol = "FUZZY_UNKNOWN";
        mime_types = ["application/*"];
        max_score = 20.0;
        read_only = yes;
        skip_unknown = yes;
        fuzzy_map = {
            FUZZY_DENIED {
                max_score = 20.0;
                flag = 1;
            }
            FUZZY_PROB {
                max_score = 10.0;
                flag = 2;
            }
            FUZZY_WHITE {
                max_score = 2.0;
                flag = 3;
            }
        }
    }
    rule {
        servers = "localhost:11335";
        symbol = "LOCAL_FUZZY_UNKNOWN";
        mime_types = "application/pdf";
        mime_types = "*";
        max_score = 20.0;
        read_only = no;
        skip_unknown = yes;
        fuzzy_map = {
            LOCAL_FUZZY_DENIED {
                max_score = 20.0;
                flag = 11;
            }
            LOCAL_FUZZY_PROB {
                max_score = 10.0;
                flag = 12;
            }
            LOCAL_FUZZY_WHITE {
                max_score = 2.0;
                flag = 13;
            }
        }
    }
}
~~~

**Comment by vstakhov** [comment]
That's quite strange, could you also check if there is a valid schema in your files? This could be done by typing `.schema` in your sqlite3 console.

**Comment by moisseev** [comment]
~~~sql
sqlite> .schema
CREATE TABLE digests(id INTEGER PRIMARY KEY,flag INTEGER NOT NULL,digest TEXT NOT NULL,value INTEGER,time INTEGER);
CREATE TABLE shingles(value INTEGER NOT NULL,number INTEGER NOT NULL,digest_id INTEGER REFERENCES digests(id) ON DELETE CASCADE ON UPDATE CASCADE);
CREATE INDEX t ON digests(time);
CREATE INDEX dgst_id ON shingles(digest_id);
CREATE UNIQUE INDEX d ON digests(digest);
CREATE UNIQUE INDEX s ON shingles(value, number);
sqlite>
~~~

**Comment by vstakhov** [comment]
Do you use encryption?

**Comment by moisseev** [comment]
I don't think so. At least I don't have an encryption key configured for the rule. How can I check that?

**Comment by vstakhov** [comment]
Hm, maybe then you could try to learn your fuzzy and dump packets that are send during such a learn session?

**Comment by moisseev** [comment]
~~~
# tcpdump -n -nn -ttt -i lo0 -w learning.cap portrange 11333-11335

# rspamc -h localhost:11334 -w 20 -f 13 fuzzy_add bugzilla.eml
Results for file: bugzilla.eml (0.003 seconds)
success = true;
~~~
The dump has been mailed to @vstakhov .

**Comment by vstakhov** [comment]
I've found the bug, thank you! I'm working on fix, and this bug is super critical, I'm afraid.

**Comment by vstakhov** [comment]
Just to confirm: which platform and OS are you using?

**Comment by moisseev** [comment]
~~~
# uname -mv
FreeBSD 10.2-RELEASE-p7 #0: Mon Nov  2 13:38:49 UTC 2015     root@amd64-builder.daemonology.net:/usr/obj/usr/src/sys/GENERIC  i386
~~~

**Comment by vstakhov** [comment]
Aha, I've expected that it should be i386... Does the following patch fix this issue?

**Comment by moisseev** [comment]
No, it doesn't. Tested with master (e8b103d).
~~~
root@vm-FreeBSD-10_2:/var/db/rspamd # uname -mv
FreeBSD 10.2-RELEASE #0 r286666: Wed Aug 12 19:31:38 UTC 2015     root@releng1.nyi.freebsd.org:/usr/obj/usr/src/sys/GENERIC  i386
~~~
~~~
root@vm-FreeBSD-10_2:/home/moiseev # rspamc -w 20 -f 13 fuzzy_add double_bayes.eml
Results for file: double_bayes.eml (0.003 seconds)
HTTP error: 22, process fuzzy error

root@vm-FreeBSD-10_2:/home/moiseev # rspamc -w 20 -f 13 fuzzy_add double_bayes.eml
Results for file: double_bayes.eml (0.002 seconds)
success = true;

root@vm-FreeBSD-10_2:/home/moiseev # rspamc -w 20 -f 13 fuzzy_add double_bayes.eml
Results for file: double_bayes.eml (0.002 seconds)
HTTP error: 22, process fuzzy error

root@vm-FreeBSD-10_2:/home/moiseev # rspamc -w 20 -f 13 fuzzy_add double_bayes.eml
Results for file: double_bayes.eml (0.002 seconds)
success = true;
~~~
~~~
2016-01-14 21:38:40 #19596(controller) <ccbf86>; csession; rspamd_controller_check_password: allow unauthorized connection from a trusted IP 127.0.0.1
2016-01-14 21:38:40 #19596(controller) <f7793b>; task; rspamd_message_parse: loaded message; id: <CDC950F30AA345419D82DEDFF084C80BEC7BE5E0@winmailmbx23.msbo.masterhost.ru>; queue-id: <undef>
2016-01-14 21:38:40 #19596(controller) <f7793b>; task; fuzzy_controller_io_callback: cannot process fuzzy hash for message <CDC950F30AA345419D82DEDFF084C80BEC7BE5E0@winmailmbx23.msbo.masterhost.ru>, list LOC
2016-01-14 21:38:42 #19596(controller) <4f5e76>; csession; rspamd_controller_check_password: allow unauthorized connection from a trusted IP 127.0.0.1
2016-01-14 21:38:42 #19596(controller) <d78451>; task; rspamd_message_parse: loaded message; id: <CDC950F30AA345419D82DEDFF084C80BEC7BE5E0@winmailmbx23.msbo.masterhost.ru>; queue-id: <undef>
2016-01-14 21:38:42 #19596(controller) <d78451>; task; fuzzy_controller_io_callback: processed fuzzy hash <855711314>, list: LOCAL_FUZZY_WHITE:13 for message <CDC950F30AA345419D82DEDFF084C80BEC7BE5E0@winmail
2016-01-14 21:38:42 #19596(controller) <d78451>; task; fuzzy_controller_io_callback: processed fuzzy hash <-1931590726>, list: LOCAL_FUZZY_WHITE:13 for message <CDC950F30AA345419D82DEDFF084C80BEC7BE5E0@winma
2016-01-14 21:38:42 #19596(controller) <d78451>; task; fuzzy_controller_io_callback: processed fuzzy hash <-783515639>, list: LOCAL_FUZZY_WHITE:13 for message <CDC950F30AA345419D82DEDFF084C80BEC7BE5E0@winmai
2016-01-14 21:38:44 #19596(controller) <ba4282>; csession; rspamd_controller_check_password: allow unauthorized connection from a trusted IP 127.0.0.1
2016-01-14 21:38:44 #19596(controller) <4a8b7d>; task; rspamd_message_parse: loaded message; id: <CDC950F30AA345419D82DEDFF084C80BEC7BE5E0@winmailmbx23.msbo.masterhost.ru>; queue-id: <undef>
2016-01-14 21:38:44 #19596(controller) <4a8b7d>; task; fuzzy_controller_io_callback: cannot process fuzzy hash for message <CDC950F30AA345419D82DEDFF084C80BEC7BE5E0@winmailmbx23.msbo.masterhost.ru>, list LOC
2016-01-14 21:38:45 #19596(controller) <3a16b4>; csession; rspamd_controller_check_password: allow unauthorized connection from a trusted IP 127.0.0.1
2016-01-14 21:38:45 #19596(controller) <503639>; task; rspamd_message_parse: loaded message; id: <CDC950F30AA345419D82DEDFF084C80BEC7BE5E0@winmailmbx23.msbo.masterhost.ru>; queue-id: <undef>
2016-01-14 21:38:45 #19596(controller) <503639>; task; fuzzy_controller_io_callback: processed fuzzy hash <-722494249>, list: LOCAL_FUZZY_WHITE:13 for message <CDC950F30AA345419D82DEDFF084C80BEC7BE5E0@winmai
2016-01-14 21:38:45 #19596(controller) <503639>; task; fuzzy_controller_io_callback: processed fuzzy hash <-1726317954>, list: LOCAL_FUZZY_WHITE:13 for message <CDC950F30AA345419D82DEDFF084C80BEC7BE5E0@winma
2016-01-14 21:38:45 #19596(controller) <503639>; task; fuzzy_controller_io_callback: processed fuzzy hash <2071726374>, list: LOCAL_FUZZY_WHITE:13 for message <CDC950F30AA345419D82DEDFF084C80BEC7BE5E0@winmai
2016-01-14 21:39:42 #19595(fuzzy) <0fcf2f>; fuzzy_backend; rspamd_fuzzy_backend_finish_update: total number of frames in the wal file: 0, checkpointed: 0
2016-01-14 21:39:42 #19595(fuzzy) rspamd_fuzzy_process_updates_queue: updated fuzzy storage: 6 updates processed
2016-01-14 21:39:42 #19595(fuzzy) <0fcf2f>; fuzzy_backend; rspamd_fuzzy_backend_sync: deleted 0 orphaned shingles
~~~
~~~
root@vm-FreeBSD-10_2:/var/db/rspamd # sqlite3 fuzzy.db
SQLite version 3.10.0 2016-01-06 11:01:07
Enter ".help" for usage hints.
sqlite> SELECT Count(*) FROM digests;
29
sqlite> SELECT Count(*) FROM shingles;
0
sqlite> .quit
~~~

**Comment by vstakhov** [comment]
It seems I cannot install freebsd i386 on digital ocean. To tell the truth I see no point in supporting of i386 at all. I'll try with i386 linux but if that won't be reproduced on linux, then I won't spend my time for this issue no longer.

**Comment by vstakhov** [comment]
Ok, I've clearly reproduced the issue and it seems I've found and fixed the culprit. Coul you please test the master branch now?

**Comment by moisseev** [comment]
Yes, it has finally started inserting shingles into database, but I still have an issue with `HTTP error: 22, process fuzzy error`. Only every second learning attempt is successful.
I've also found the learned data is not available for scanning (and not stored in the database) for about 1 minute. In 1.0.11 it is available immediately.
~~~
root@vm-FreeBSD-10_2:/home/moiseev # rspamc -w 20 -f 13 fuzzy_add bugzilla.eml
Results for file: bugzilla.eml (0.003 seconds)
HTTP error: 22, process fuzzy error

root@vm-FreeBSD-10_2:/home/moiseev # rspamc -w 20 -f 13 fuzzy_add bugzilla.eml
Results for file: bugzilla.eml (0.001 seconds)
success = true;
~~~
~~~
2016-01-15 09:08:47 #24345(controller) <d0f971>; csession; rspamd_controller_check_password: allow unauthorized connection from a trusted IP 127.0.0.1
2016-01-15 09:08:47 #24345(controller) <500fb4>; task; rspamd_message_parse: loaded message; id: <E1aJGiG-00H56J-Rl@bugzilla.samba.org>; queue-id: <undef>
2016-01-15 09:08:47 #24345(controller) <500fb4>; task; fuzzy_controller_io_callback: cannot process fuzzy hash for message <E1aJGiG-00H56J-Rl@bugzilla.samba.org>, list LOCAL_FUZZY_WHITE:13, error: 403
2016-01-15 09:10:35 #24344(fuzzy) <0fcf2f>; fuzzy_backend; rspamd_fuzzy_backend_finish_update: total number of frames in the wal file: 0, checkpointed: 0
2016-01-15 09:10:35 #24344(fuzzy) rspamd_fuzzy_process_updates_queue: updated fuzzy storage: 0 updates processed
2016-01-15 09:10:35 #24344(fuzzy) <0fcf2f>; fuzzy_backend; rspamd_fuzzy_backend_sync: deleted 0 orphaned shingles
2016-01-15 09:12:26 #24344(fuzzy) <0fcf2f>; fuzzy_backend; rspamd_fuzzy_backend_finish_update: total number of frames in the wal file: 0, checkpointed: 0
2016-01-15 09:12:26 #24344(fuzzy) rspamd_fuzzy_process_updates_queue: updated fuzzy storage: 0 updates processed
2016-01-15 09:12:26 #24344(fuzzy) <0fcf2f>; fuzzy_backend; rspamd_fuzzy_backend_sync: deleted 0 orphaned shingles
2016-01-15 09:13:20 #24345(controller) <4e2a1c>; csession; rspamd_controller_check_password: allow unauthorized connection from a trusted IP 127.0.0.1
2016-01-15 09:13:20 #24345(controller) <465a25>; task; rspamd_message_parse: loaded message; id: <E1aJGiG-00H56J-Rl@bugzilla.samba.org>; queue-id: <undef>
2016-01-15 09:13:20 #24345(controller) <465a25>; task; fuzzy_controller_io_callback: processed fuzzy hash <2060307297>, list: LOCAL_FUZZY_WHITE:13 for message <E1aJGiG-00H56J-Rl@bugzilla.samba.org>
2016-01-15 09:13:20 #24345(controller) <465a25>; task; fuzzy_controller_io_callback: processed fuzzy hash <757405565>, list: LOCAL_FUZZY_WHITE:13 for message <E1aJGiG-00H56J-Rl@bugzilla.samba.org>
2016-01-15 09:13:20 #24345(controller) <465a25>; task; fuzzy_controller_io_callback: processed fuzzy hash <538266399>, list: LOCAL_FUZZY_WHITE:13 for message <E1aJGiG-00H56J-Rl@bugzilla.samba.org>
2016-01-15 09:14:22 #24344(fuzzy) <0fcf2f>; fuzzy_backend; rspamd_fuzzy_backend_finish_update: total number of frames in the wal file: 0, checkpointed: 0
2016-01-15 09:14:22 #24344(fuzzy) rspamd_fuzzy_process_updates_queue: updated fuzzy storage: 3 updates processed
2016-01-15 09:14:22 #24344(fuzzy) <0fcf2f>; fuzzy_backend; rspamd_fuzzy_backend_sync: deleted 0 orphaned shingles
~~~
Do you really plan to drop support for i386?  It's very disappointing. About 90% of my hardware has i386 arch and I don't plan to upgrade it for a few years.

**Comment by vstakhov** [comment]
Well, i386 is not the primary platform and rspamd may perform poor on it. What's worse is that I have no machines to test i386 environment. So my `support` is quite limited, to tell the truth. Regarding your error: I could not reproduce it, so any traces (like ktrace + kdump) for both controller and fuzzy worker are appreciated.

**Comment by vstakhov** [comment]
And updates once per minute are expected. That's required for better fuzzy worker scaling.

**Comment by moisseev** [comment]
I can't do tracing right now. I'll do it first thing tomorrow morning.
I'm just wondering if you have considered using a virtual machine (e. g. VirtualBox) for testing?

**Comment by vstakhov** [comment]
That's too complicated I have neither time nor resources for that. DigitalOcean is perfect, but they don't have FreeBSD i386. Another question is: for the god sake, why do you use i386 in 2016?? I just don't understand that.

**Comment by moisseev** [comment]
For now we have no performance problems with over than 10 years old hardware we have. I see no point in moving from 32-bit to 64-bit hardware if users won't have any benefit of it. Changing of architecture just for fun implies fork-lift upgrade and investments with zero ROI.

**Comment by vstakhov** [comment]
Right, that's quite interesting as there are a lot of possible optimizations for i386 and other 32 bits platforms. For example, I could change xxhash64 to some more performance hash function for 32 bits and use ssse3 for some certain operations. But I'd need some feedback for that actions.

**Comment by moisseev** [comment]
It's interesting. When you'll have time for it feel free to ask for testing. But for now, would you fix `HTTP error: 22, process fuzzy error`? I am getting it on every odd learning attempt. It's not critical, but a bit inconvenient.

**Comment by vstakhov** [comment]
What if you change `localhost` to `127.0.0.1` everywhere?

**Comment by moisseev** [comment]
I've changed `servers = "localhost:11335";` to `servers = "127.0.0.1:11335";` in fuzzy_check configuration and it works properly.

But it doesn't work with `::1`.
~~~
fuzzy_check {
    .include(try=true,priority=1) "${DBDIR}/dynamic/fuzzy_check.conf"
    min_bytes = 100;
    rule {
        servers = "[::1]:11335";
...
~~~
~~~
# rspamadm configtest
...
2016-01-22 20:53:12 #3555((NULL)) rspamd_parse_host_port_priority_strv: cannot parse port: , at symbol
2016-01-22 20:53:12 #3555((NULL)) rspamd_parse_host_port_priority_strv: cannot parse priority: 1], at symbol ], error: No error: 0
2016-01-22 20:53:12 #3555((NULL)) rspamd_parse_host_port_priority_strv: address resolution for [ failed: servname not supported for ai_socktype
2016-01-22 20:53:12 #3555((NULL)) <z9ijff>; cfg; fuzzy_parse_rule: no servers defined for fuzzy rule with symbol: LOCAL_FUZZY_UNKNOWN
2016-01-22 20:53:12 #3555((NULL)) <z9ijff>; cfg; fuzzy_check_module_config: fuzzy module is enabled but no rules are defined
...
~~~

**Comment by vstakhov** [comment]
It seems that your system lacks ipv6 support (as usually).

**Comment by moisseev** [comment]
What do you mean "lacks"?
At least the fuzzy worker is listening on ipv6 socket.
~~~
nobody   rspamd-1.1 3678  7  udp6   ::1:11335             *:*
nobody   rspamd-1.1 3677  7  udp6   ::1:11335             *:*
nobody   rspamd-1.1 3676  7  udp6   ::1:11335             *:*
nobody   rspamd-1.1 3675  7  udp6   ::1:11335             *:*
nobody   rspamd-1.1 3674  7  udp6   ::1:11335             *:*
~~~
Also I'm able to connect to loopback with `ssh ::1`.

**Comment by xpunkt** [comment]
worker type fuzzy missing server

# rspamd.conf.local

worker {
    bind_socket = "localhost:11335";
    type = "fuzzy";
    hash_file = "/var/lib/rspamd/fuzzy.sqlite";
    expire = 90d;
    allow_update = "::1";
    allow_update = "127.0.0.1";
    # count = 8;
}

**Comment by moisseev** [comment]
@xpunkt sorry, I don't understand what you mean.

Full configuration:

rspamd.conf.local.override
~~~
worker {
    bind_socket = "localhost:11333";
    .include "$CONFDIR/worker-normal.inc"
}

worker {
    bind_socket = "*:11334";
    .include "$CONFDIR/worker-controller.inc.local"
}

worker {
    type = "fuzzy";
    count = 1;
    bind_socket = "*:11335";
    hash_file = "${DBDIR}/fuzzy.db"
    expire = 360d;
    allow_update = "127.0.0.1";
    allow_update = "::1";
}

fuzzy_check {
    # Include dynamic conf for the rule
    .include(try=true,priority=1) "${DBDIR}/dynamic/fuzzy_check.conf"
    min_bytes = 100;
    rule {
#        servers = "localhost:11335";
#        servers = "127.0.0.1:11335";
        servers = "[::1]:11335";
        symbol = "LOCAL_FUZZY_UNKNOWN";
        mime_types = "application/pdf";
        mime_types = "*";
        max_score = 20.0;
        read_only = no;
        skip_unknown = yes;
        fuzzy_map = {
            LOCAL_FUZZY_DENIED {
                max_score = 20.0;
                flag = 11;
            }
            LOCAL_FUZZY_PROB {
                max_score = 10.0;
                flag = 12;
            }
            LOCAL_FUZZY_WHITE {
                max_score = 2.0;
                flag = 13;
            }
        }
    }
}
~~~

**Comment by xpunkt** [comment]
netstat -natpu | grep 11335

if its listen on both ipv4 and ipv6 then servers fyzzy should work as client config with localhost:11335 it does here

maybe you miss the worker in rspamadm configdump ?

**Comment by moisseev** [comment]
I don't think it is a configuration problem. I didn't have it before 1.1.0.
~~~
 # netstat -na | grep 11335
udp6       0      0 *.11335                *.*
udp4       0      0 *.11335                *.*
~~~
~~~
# rspamadm configdump
...
worker {
    type = "fuzzy";
    count = 1;
    bind_socket = "*:11335";
    hash_file = "/var/db/rspamd/fuzzy.db";
    expire = 31104000.0;
    allow_update = "127.0.0.1";
    allow_update = "::1";
}
...
~~~

**Comment by xpunkt** [comment]
* is gready and might not work

replace with same as in bind_socket should work, ah worker with *

have you multiple dns on in host.conf ?, is localhost in /etc/hosts both with ipv4 and ipv6 ?

note fqdn must be listed first, many instalations have non-fqdn first with gives incorrect results

127.0.0.01 localhost.localdomain localhost
::1 localhost.localdomain localhost

my own workers use localhost:portnum and works both in workers and clients

**Comment by moisseev** [comment]
I have no problem with name resolution.
There are two issues:

1. `servers = "localhost:11335";` As you can see in tcpdump output below the localhost host name resolved correctly to 127.0.0.1 and ::1 and that addresses used on round-robin basis to communicate with fuzzy worker. And there is two-way UDP packet interchange with fuzzy worker in both cases (ipv4 and ipv6).

2. `servers = "[::1]:11335";`
rspamd failed to parse ipv6 address
~~~
# rspamadm configtest
...
2016-01-23 17:18:42 #4366((NULL)) rspamd_parse_host_port_priority_strv: cannot parse port: , at symbol
2016-01-23 17:18:42 #4366((NULL)) rspamd_parse_host_port_priority_strv: cannot parse priority: 1], at symbol ], error: No error: 0
2016-01-23 17:18:42 #4366((NULL)) rspamd_parse_host_port_priority_strv: address resolution for [ failed: servname not supported for ai_socktype
...
~~~


tcpdump output
~~~
root@vm-FreeBSD-10_2:/home/moiseev # tcpdump -n -nn -ttt -i lo0 portrange 11333-11335
tcpdump: verbose output suppressed, use -v or -vv for full protocol decode
listening on lo0, link-type NULL (BSD loopback), capture size 65535 bytes
^Z
Suspended
root@vm-FreeBSD-10_2:/home/moiseev # rspamc -w 20 -f 13 fuzzy_add bugzilla.eml
Results for file: bugzilla.eml (0.002 seconds)
success = true;

root@vm-FreeBSD-10_2:/home/moiseev # rspamc -w 20 -f 13 fuzzy_add bugzilla.eml
Results for file: bugzilla.eml (0.001 seconds)
HTTP error: 22, process fuzzy error

root@vm-FreeBSD-10_2:/home/moiseev # fg 1
tcpdump -n -nn -ttt -i lo0 portrange 11333-11335
00:00:00.000000 IP 127.0.0.1.36128 > 127.0.0.1.11334: Flags [S], seq 3148386112, win 65535, options [mss 16344,nop,wscale 6,sackOK,TS val 14135220 ecr 0], length 0
00:00:00.000291 IP 127.0.0.1.11334 > 127.0.0.1.36128: Flags [S.], seq 756860378, ack 3148386113, win 65535, options [mss 16344,nop,wscale 6,sackOK,TS val 1322626452 ecr 14135220], length 0
00:00:00.000010 IP 127.0.0.1.36128 > 127.0.0.1.11334: Flags [.], ack 1, win 1275, options [nop,nop,TS val 14135221 ecr 1322626452], length 0
00:00:00.000031 IP 127.0.0.1.36128 > 127.0.0.1.11334: Flags [P.], seq 1:3216, ack 1, win 1275, options [nop,nop,TS val 14135221 ecr 1322626452], length 3215
00:00:00.001180 IP 127.0.0.1.36889 > 127.0.0.1.11335: UDP, length 332
00:00:00.000117 IP 127.0.0.1.36889 > 127.0.0.1.11335: UDP, length 76
00:00:00.000571 IP 127.0.0.1.11335 > 127.0.0.1.36889: UDP, length 16
00:00:00.000040 IP 127.0.0.1.11335 > 127.0.0.1.36889: UDP, length 16
00:00:00.000116 IP 127.0.0.1.11334 > 127.0.0.1.36128: Flags [P.], seq 1:166, ack 3216, win 1275, options [nop,nop,TS val 1322626454 ecr 14135221], length 165
00:00:00.000020 IP 127.0.0.1.11334 > 127.0.0.1.36128: Flags [F.], seq 166, ack 3216, win 1275, options [nop,nop,TS val 1322626454 ecr 14135221], length 0
00:00:00.000022 IP 127.0.0.1.36128 > 127.0.0.1.11334: Flags [.], ack 167, win 1273, options [nop,nop,TS val 14135223 ecr 1322626454], length 0
00:00:00.000109 IP 127.0.0.1.36128 > 127.0.0.1.11334: Flags [F.], seq 3216, ack 167, win 1275, options [nop,nop,TS val 14135223 ecr 1322626454], length 0
00:00:00.000033 IP 127.0.0.1.11334 > 127.0.0.1.36128: Flags [.], ack 3217, win 1275, options [nop,nop,TS val 1322626454 ecr 14135223], length 0
00:00:02.242041 IP 127.0.0.1.40312 > 127.0.0.1.11334: Flags [S], seq 3819371099, win 65535, options [mss 16344,nop,wscale 6,sackOK,TS val 14137465 ecr 0], length 0
00:00:00.000349 IP 127.0.0.1.11334 > 127.0.0.1.40312: Flags [S.], seq 3205121608, ack 3819371100, win 65535, options [mss 16344,nop,wscale 6,sackOK,TS val 304007331 ecr 14137465], length 0
00:00:00.000064 IP 127.0.0.1.40312 > 127.0.0.1.11334: Flags [.], ack 1, win 1275, options [nop,nop,TS val 14137465 ecr 304007331], length 0
00:00:00.000075 IP 127.0.0.1.40312 > 127.0.0.1.11334: Flags [P.], seq 1:3216, ack 1, win 1275, options [nop,nop,TS val 14137465 ecr 304007331], length 3215
00:00:00.001289 IP6 ::1.16274 > ::1.11335: UDP, length 332
00:00:00.000019 IP6 ::1.16274 > ::1.11335: UDP, length 76
00:00:00.000084 IP6 ::1.11335 > ::1.16274: UDP, length 16
00:00:00.000022 IP6 ::1.11335 > ::1.16274: UDP, length 16
00:00:00.000099 IP 127.0.0.1.11334 > 127.0.0.1.40312: Flags [P.], seq 1:197, ack 3216, win 1275, options [nop,nop,TS val 304007333 ecr 14137465], length 196
00:00:00.000021 IP 127.0.0.1.11334 > 127.0.0.1.40312: Flags [F.], seq 197, ack 3216, win 1275, options [nop,nop,TS val 304007333 ecr 14137465], length 0
00:00:00.000020 IP 127.0.0.1.40312 > 127.0.0.1.11334: Flags [.], ack 198, win 1272, options [nop,nop,TS val 14137467 ecr 304007333], length 0
00:00:00.000076 IP 127.0.0.1.40312 > 127.0.0.1.11334: Flags [F.], seq 3216, ack 198, win 1275, options [nop,nop,TS val 14137467 ecr 304007333], length 0
00:00:00.000036 IP 127.0.0.1.11334 > 127.0.0.1.40312: Flags [.], ack 3217, win 1275, options [nop,nop,TS val 304007333 ecr 14137467], length 0
^C
26 packets captured
26 packets received by filter
0 packets dropped by kernel
~~~

**Comment by vstakhov** [comment]
It seems, that rspamd does not understand IPv6 addresses in braces. I'll check...

**Comment by moisseev** [comment]
I've tested f624af1. Problem with ipv6 address parsing solved.
I've successfully configured fuzzy worker and rule with ipv6 loopback only.
But rspamc still cannot work with fuzzy worker through ipv6 socket.

Another issue: rspamc doesn't understand ipv6 addresses:
~~~
# rspamc uptime -h [::1]:11334
rspamc: Нет соответствий.

# rspamc uptime -h 127.0.0.1:11334
Results for command: uptime (0.000 seconds)
Rspamd version: 1.1.2
Uptime: 10 seconds
~~~

**Comment by moisseev** [comment]
~~~
# rspamc -h 127.0.0.1:11334 -w 20 -f 13 fuzzy_add bugzilla.eml
Results for file: bugzilla.eml (0.002 seconds)
success = true;

# rspamc -h 127.0.0.1:11334 -w 20 -f 13 fuzzy_add bugzilla.eml
Results for file: bugzilla.eml (0.002 seconds)
HTTP error: 22, process fuzzy error

# rspamc -h 127.0.0.1:11334 -w 20 -f 13 fuzzy_add bugzilla.eml
Results for file: bugzilla.eml (0.002 seconds)
success = true;

# rspamc -h 127.0.0.1:11334 -w 20 -f 13 fuzzy_add bugzilla.eml
Results for file: bugzilla.eml (0.001 seconds)
HTTP error: 22, process fuzzy error
~~~
~~~
# rspamc -h '[::1]:11334' -w 20 -f 13 fuzzy_add bugzilla.eml
Results for file: bugzilla.eml (0.002 seconds)
success = true;

# rspamc -h '[::1]:11334' -w 20 -f 13 fuzzy_add bugzilla.eml
Results for file: bugzilla.eml (0.002 seconds)
HTTP error: 22, process fuzzy error

# rspamc -h '[::1]:11334' -w 20 -f 13 fuzzy_add bugzilla.eml
Results for file: bugzilla.eml (0.001 seconds)
success = true;

# rspamc -h '[::1]:11334' -w 20 -f 13 fuzzy_add bugzilla.eml
Results for file: bugzilla.eml (0.001 seconds)
HTTP error: 22, process fuzzy error
~~~
~~~
# rspamadm configdump fuzzy_check
*** Section fuzzy_check ***
min_bytes = 100;
rule {
    servers = "localhost:11335";
    symbol = "LOCAL_FUZZY_UNKNOWN";
    mime_types = "*";
    max_score = 20.0;
    read_only = false;
    skip_unknown = true;
    fuzzy_map {
        LOCAL_FUZZY_WHITE {
            max_score = 2.0;
            flag = 13;
        }
    }
}
*** End of section fuzzy_check ***
~~~

**Comment by moisseev** [comment]
I've configured fuzzy to use IPv6 only. Why I'm getting error: 403 ?
Is `allow_update = "::1";` correct?
~~~
# rspamc -w 20 -f 13 fuzzy_add bugzilla.eml
Results for file: bugzilla.eml (0.002 seconds)
HTTP error: 22, process fuzzy error
~~~
~~~
2016-06-24 14:19:16 #12593(controller) <cb58ed>; csession; rspamd_controller_check_password: allow unauthorized connection from a trusted IP 127.0.0.1
2016-06-24 14:19:16 #12593(controller) <009ab4>; task; rspamd_message_parse: loaded message; id: <E1aJGiG-00H56J-Rl@bugzilla.samba.org>; queue-id: <undef>
2016-06-24 14:19:16 #12593(controller) <009ab4>; task; fuzzy_controller_io_callback: cannot process fuzzy hash for message <E1aJGiG-00H56J-Rl@bugzilla.samba.org>, 40cb559699, list LOCAL_FUZZY_WHITE:13, error: 403

~~~
~~~
# rspamadm configdump fuzzy_check
*** Section fuzzy_check ***
min_bytes = 100;
rule {
    servers = "[::1]:11335";
    symbol = "LOCAL_FUZZY_UNKNOWN";
    mime_types = "*";
    max_score = 20.0;
    read_only = false;
    skip_unknown = true;
    fuzzy_map {
        LOCAL_FUZZY_WHITE {
            max_score = 2.0;
            flag = 13;
        }
    }
}
*** End of section fuzzy_check ***
~~~
~~~
# rspamadm configdump worker
*** Section worker ***
type = "fuzzy";
count = 1;
bind_socket = "[::1]:11335";
hash_file = "/var/db/rspamd/fuzzy.db";
expire = 31104000.0;
allow_update = "127.0.0.1";
allow_update = "::1";
*** End of section worker ***
...
~~~
